category,product,price,image,stock
Baby Products,Huggies Newborn Nappies Size 1 28pck,13.00,huggies-newborn-nappies-size-1.jpg,8
Baby Products,Pediasure Vanilla New Formula 850g,50.50,pediasure_vanilla.jpg,12
Baby Products,Bellamy’s Organic Baby Porridge,4.00,ballamys_porridge.jpg,20
Baby Products,CeraVe Baby Wash Shampoo 473ml,23.00,cerave_babywash.jpg,3
Baby Products,Sudocrem Healing Cream 125g,14.00,sudocrem_125g.jpg,0
Baby Products,Bepanthen Antiseptic Cream 100g,17.50,bepanthen_100g.jpg,3
Baby Products,Vaseline Petroleum Jelly 50g Jar,3.99,vaseline_50g.jpg,15
Baby Products,Johnson's Gentle Moisturising Baby Soap Bar Twin Pack,4.50,johnson_twin_soap.jpg,23
Baby Products,Cetaphil Baby Gentle Wash and Shampoo 400ml,14.00,cetaphil_baby_wash_shampoo_400ml.jpg,45
Baby Products,Bonjela Teething and Mouth Ulcer Gel 15g,9.99,bonjela_teething_gel_15g.jpg,34
Baby Products,Avent Natural Response Feeding Bottle 260ml 2 Pack,31.95,avent_feeding_bottle_260ml_2pck.jpg,29
Supplements,Ferro-Grad C Iron & Vitamin C 30 Tablets,22.99,ferrogradC_30.jpg,0
Supplements,Ostelin Vitamin D3 1000IU 60 Capsules,11.00,ostelin_vitaminD3_60caps.jpg,0
Supplements,Centrum Women Daily Multivitamin 60 Pack,21.99,centrum-women.jpg,30
Supplements,Caruso's Triple Strength Fish Oil Concentrate 150 Caps,89.95,caruso_fishoil_concentrate_150caps.jpg,19
Supplements,Swisse Ultiboost Magnesium 60 Tablets,15.99,swisse-magnesium-60tab.jpg,38
Supplements,Blackmores Evening Primrose Oil 125 Capsules,30.00,blackmores_evening_primrose_oil.jpg,17
Supplements,Nature's Own Glucosamine Sulfate And Chondroitin Advanced Tablets 180,28.95,natures-own-glucosamine.jpg,7
Supplements,Elevit Pre-conception & Pregnancy 100 Tablets,59.99,elevit_preconception_pregnancy_100tabs.jpg,8
Supplements,Bioglan Red Krill Oil 1000mg 60 Capsules,92.00,biogla_red_krill_oil_1000mg_60caps.jpg,23
Supplements,Ensure Vanilla 850g,45.50,ensure_vanilla_850g.jpg,5
Skincare,CeraVe Moisturising Cream 340g,24.99,cerave_moisturising_cream_340g.jpg,15
Skincare,La Roche-Posay Toleriane Sensitive Riche 40ml,34.95,la_roche_posay_toleriane_riche_40ml.jpg,10
Skincare,Neutrogena Hydro Boost Water Gel 50g,27.00,neutrogena_hydro_boost_50g.jpg,20
Beauty,L'Oréal Paris Telescopic Mascara Black,24.50,loreal_telescopic_mascara.jpg,18
Beauty,Revlon Super Lustrous Lipstick – Fire & Ice,19.99,revlon_lipstick_fire_ice.jpg,30
Incontinence,TENA Pants Discreet Normal Medium 8 Pack,19.50,tena_pants_discreet_medium.png,12
Incontinence,Depend Real Fit Underwear for Women Large 8 Pack,22.00,depend_realfit_women_large.jpg,10
Incontinence,Poise Pads Extra Plus 10 Pack,9.99,poise_pads_extra_plus.jpg,28
Medicine,Nurofen Zavance Pain Relief Tablets 24 Pack,12.49,nurofen_zavance_24.png,35
Medicine,Panadol Rapid Caplets 20 Pack,7.50,panadol_rapid_20.png,40
Medicine,Claratyne Allergy Relief Tablets 10 Pack,11.99,claratyne_allergy_relief_10.png,22