Category,Product,Price,Image
Baby Products,Huggies Newborn Nappies Size 1 28pck,$13.00,
Baby Products,Pediasure Vanilla New Formula 850g,$50.50,
Baby Products,Bellamy’s Organic Baby Porridge,$4.00,
Baby Products,CeraVe Baby Wash Shampoo 473ml,$23.00,
Baby Products,Sudocrem Healing Cream 125g,$14.00,
Baby Products,Bepanthen Antiseptic Cream 100g,$17.50,
Baby Products,Vaseline Petroleum Jelly 50g Jar,$3.99,
Baby Products,Johnson's Gentle Moisturising Baby Soap Bar Twin Pack,$4.50,
Baby Products,Cetaphil Baby Gentle Wash and Shampoo 400ml,$14.00,
Baby Products,Bonjela Teething and Mouth Ulcer Gel 15g,$9.99,
Baby Products,Avent Natural Response Feeding Bottle 260ml 2 Pack,$31.95,
Supplements,Ferro-Grad C Iron & Vitamin C 30 Tablets,$22.99,
Supplements,Ostelin Vitamin D3 1000IU,$11.00,
Supplements,Centrum Women Daily Multivitamin 60 Pack,$21.99,
Supplements,Caruso's Triple Strength Fish Oil Concentrate 150 Caps,$89.95,
Supplements,Swisse Ultiboost Magnesium 60 Tablets,$15.99,
Supplements,Blackmores Evening Primrose OIl 125 Capsules,$30.00,
Supplements,Nature's Own Glucosamine Sulfate And Chondroitin Advanced Tablets 180,$28.95,
Supplements,Elevit Pre-conception & Pregnancy 100 Tablets,$59.99,
Supplements,Bioglan Red Krill Oil 1000mg 60 Capsules,$92.00,
Supplements,Ensure Vanilla 850g,$45.50,